{
  "version": 1,
  "task": {
    "id": "awkit-vra-4-qc-n3-1013",
    "title": "N3 independent QC: close the review findings and the N3 epic",
    "objective": "Run the independent QC review of N3 (closure criterion 5 of docs/plans/ai-upgrade-v5/N3-visual-locator-recovery.md) over N3.1 decideVisualAgreement and N3.3 VisualFusionStage.agree with its recover() hook and verify:visual-agreement-runtime, close its findings (Q4-a: the N2 observation and the agreement share one FD-5 400 ms budget per attempt, J9; Q8/Q9-a: the J6 A/B keeps the N2 visual block and the docs name the event-message suffix; Q8-b: the sensitive check is non-vacuous; Q8-c: retry disposition recorded), record the review in the N3 plan, ARCHITECTURE, DECISIONS and state, and close awkit-vra.4 with N3.4 and N3.5 still deferred blocked.",
    "requested_by": "repository owner",
    "mode": "change",
    "risk_level": 2
  },
  "repository": {
    "branch": "main",
    "baseline_commit": "0e38f26a",
    "working_tree_expected": "preserved_changes",
    "preserved_paths": [
      {
        "path": "docs/ai/contracts/awkit-l12-27-implementation-1006.json",
        "git_status": "??",
        "sha256": "c32103a1ed64131a6359bf4d1662d5306a1a165754ac72347e8778723b35a4a2"
      }
    ]
  },
  "classification": {
    "project_state_change": true,
    "runner_change": true,
    "execution_change": true,
    "cross_layer_count": 1
  },
  "routing": {
    "manager": "manager",
    "activated_agents": [
      "manager",
      "software",
      "runtime",
      "qa",
      "qc",
      "project-state"
    ],
    "expected_paths": [
      ".beads/**",
      "src/runner/LocatorFactory.ts",
      "scripts/verify-visual-agreement-runtime.mts",
      "scripts/verify-roadmap-dashboard.mjs",
      "src/roadmap/ImplementationRoadmap.ts",
      "docs/plans/ai-upgrade-v5/**",
      "docs/ai/ARCHITECTURE.md",
      "docs/ai/DECISIONS.md",
      "docs/ai/CURRENT_STATE.md",
      "docs/ai/HANDOFF.md",
      "docs/ai/TASK_LOG.md",
      "docs/ai/contracts/awkit-vra-4-qc-n3-1013.json",
      "docs/ai/contracts/active-lease.json"
    ],
    "consultants": [],
    "reviewers": [
      "qa",
      "qc"
    ],
    "writer": {
      "agent_id": "project-state",
      "allowed_paths": [
        ".beads/**"
      ]
    }
  },
  "acceptance": [
    {
      "id": "N3-QC",
      "description": "An independent reviewer that did not write N3 reviews N3.1 and N3.3; every finding is fixed or dispositioned with a recorded reason; the agreement and the N2 recovery observation share one 400 ms budget per attempt (J9) with a mutation proving the check; the J6 A/B keeps the N2 visual block; the sensitive check cannot pass on an empty record set; the existing runner and recovery suites stay green at the final source state.",
      "evidence_required": [
        "qc-review",
        "verify:visual-agreement-runtime",
        "verify:visual-agreement",
        "verify:visual-fusion-runtime",
        "verify:visual-isolation",
        "verify:runner",
        "verify:locator-guard",
        "verify:twin-pool-safety",
        "verify:recovery-provenance",
        "build"
      ]
    },
    {
      "id": "N3-QC-STATE",
      "description": "The N3 plan closure gates show criterion 5 MET with the findings table; ARCHITECTURE, DECISIONS, CURRENT_STATE, HANDOFF, TASK_LOG, ROADMAP and ImplementationRoadmap agree; awkit-vra.4 records the QC result and is closed if the tracker permits, otherwise the blocking edge is recorded as an owner action, with awkit-vra.4.4 and .4.5 still blocked; verify:roadmap-dashboard reports Sources agree.",
      "evidence_required": [
        "verify:verifier-classification",
        "beads-export",
        "verify:roadmap-dashboard"
      ]
    },
    {
      "id": "N3-QC-GIT",
      "description": "The work lands on main and is pushed without force; the L12.27 contract stays untracked and unchanged.",
      "evidence_required": [
        "git-push"
      ]
    }
  ],
  "evidence": [
    {
      "id": "qc-review",
      "type": "inspection",
      "required": true,
      "command": "independent awkit-qc-reviewer review of N3.1 and N3.3 at 0e38f26a",
      "artifact": "docs/plans/ai-upgrade-v5/N3-visual-locator-recovery.md",
      "result": "PASS",
      "observed": "APPROVED WITH FINDINGS: Q4-a minor and Q8/Q9-a minor fixed, Q8-b nit fixed, Q8-c nit dispositioned; no blocker or safety defect; the DECISIONS cross-check was not read by the reviewer and is INCONCLUSIVE"
    },
    {
      "id": "verify:visual-agreement-runtime",
      "type": "verifier",
      "required": true,
      "command": "npm run verify:visual-agreement-runtime",
      "artifact": null,
      "result": "PASS",
      "observed": "81/0 on the final source after one rerun: the first run was 79/2 when the 400 ms budget cut the seed reference capture on every attempt of two cases on a loaded host (9 cuts), unrelated to the change; mutation M5 (a fresh 400 ms for the agreement) turned 3 checks red and was reverted"
    },
    {
      "id": "verify:visual-agreement",
      "type": "verifier",
      "required": true,
      "command": "npm run verify:visual-agreement",
      "artifact": null,
      "result": "PASS",
      "observed": "258/0"
    },
    {
      "id": "verify:visual-fusion-runtime",
      "type": "verifier",
      "required": true,
      "command": "npm run verify:visual-fusion-runtime",
      "artifact": null,
      "result": "PASS",
      "observed": "145/0"
    },
    {
      "id": "verify:visual-isolation",
      "type": "verifier",
      "required": true,
      "command": "npm run verify:visual-isolation",
      "artifact": null,
      "result": "PASS",
      "observed": "40/0"
    },
    {
      "id": "verify:runner",
      "type": "verifier",
      "required": true,
      "command": "npm run verify:runner",
      "artifact": null,
      "result": "PASS",
      "observed": "138/0"
    },
    {
      "id": "verify:locator-guard",
      "type": "verifier",
      "required": true,
      "command": "npm run verify:locator-guard",
      "artifact": null,
      "result": "PASS",
      "observed": "38/0"
    },
    {
      "id": "verify:twin-pool-safety",
      "type": "verifier",
      "required": true,
      "command": "npm run verify:twin-pool-safety",
      "artifact": null,
      "result": "PASS",
      "observed": "48/0"
    },
    {
      "id": "verify:recovery-provenance",
      "type": "verifier",
      "required": true,
      "command": "npm run verify:recovery-provenance",
      "artifact": null,
      "result": "PASS",
      "observed": "46/0"
    },
    {
      "id": "verify:similar-rows-safety",
      "type": "verifier",
      "required": false,
      "command": "npm run verify:similar-rows-safety",
      "artifact": null,
      "result": "PASS",
      "observed": "68/0"
    },
    {
      "id": "verify:dom-intelligence-coverage",
      "type": "verifier",
      "required": false,
      "command": "npm run verify:dom-intelligence-coverage",
      "artifact": null,
      "result": "PASS",
      "observed": "74/0, zero wrong-element results"
    },
    {
      "id": "build",
      "type": "build",
      "required": true,
      "command": "npm run build",
      "artifact": null,
      "result": "PASS",
      "observed": "tsc --noEmit clean and electron-vite main, preload and renderer bundles built"
    },
    {
      "id": "verify:verifier-classification",
      "type": "verifier",
      "required": true,
      "command": "npm run verify:verifier-classification",
      "artifact": null,
      "result": "PASS",
      "observed": "333 verify:/validate: scripts classified, classification reconciled"
    },
    {
      "id": "beads-export",
      "type": "inspection",
      "required": true,
      "command": "bd export -o .beads/issues.jsonl",
      "artifact": ".beads/issues.jsonl",
      "result": "PASS",
      "observed": "387 issues exported after bd update of the awkit-vra.4 notes with the QC result; bd close awkit-vra.4 was refused (blocked by open awkit-vra.3, the legacy 2026-09-22 edge) and was not forced, dep removal is an owner action"
    },
    {
      "id": "verify:roadmap-dashboard",
      "type": "verifier",
      "required": true,
      "command": "npm run verify:roadmap-dashboard",
      "artifact": null,
      "result": "PASS",
      "observed": "177/177, Sources agree, 27 outstanding / 360 closed of 387, 294 edges, tally 65 PASS / 2 NOT RUN / 0 BLOCKED, pins unchanged since no issue closed; build PASS re-run after the ImplementationRoadmap note change"
    },
    {
      "id": "git-push",
      "type": "inspection",
      "required": true,
      "command": "git push origin main",
      "artifact": null,
      "result": "NOT RUN",
      "observed": "runs after the commit that carries this contract; its outcome is reported in the session report"
    }
  ],
  "git": {
    "direct_main": true,
    "commit_policy": "coherent",
    "force_push": false,
    "destructive_reset": false,
    "push_authorized": true,
    "push_evidence_id": "git-push"
  },
  "completion": {
    "status": "implemented",
    "qa_status": "PASS",
    "qc_status": "APPROVED"
  },
  "write_lease": {
    "history": [
      {
        "id": "awkit-vra-4-qc-n3-1013:project-state:2026-10-13T20:01:07.965Z",
        "task": "awkit-vra-4-qc-n3-1013",
        "holder": "project-state",
        "status": "released",
        "allowed_paths": [
          ".beads/**"
        ],
        "acquired_at": "2026-10-13T20:01:07.965Z",
        "acquired_at_commit": "0e38f26a2b2d41dddf938e04f1a5b96b49343542",
        "released_at": "2026-10-13T20:03:32.858Z",
        "released_reason": "QC findings recorded on vra.4, close blocked by legacy vra.3 edge, beads exported",
        "amendments": [],
        "overrides": [],
        "violations": []
      }
    ]
  }
}
