{
  "version": 1,
  "task": {
    "id": "awkit-djnl-4-spy-live-closeout-note-0923",
    "title": "Record the Element Spy live verifier closeout on L3",
    "objective": "At 3ae82002 verify:ai-spy-live counts host requests, paired replies and the panel's attemptsUsed (the L3 section 7 budget, refusals only) separately through askAccounting in scripts/lib/recorder-spy-harness.mts, and verify:ai-locator-attempts proves a proof refusal followed by a proven answer on the real loop and proof: 125/125, 2 calls and 1 attempt spent, the refusal kept on the record, the original counting rule failing 122/125 and the 5071606f rule 124/125. One bounded final-state live run, verify:ai-spy-live 33/0 exit 2 INCONCLUSIVE: Save profile refused twice at proof (an invented section scope), Edit (INV-2002) refused as before, T3, cancel and nothing-written PASS, no proposal shown, not retried. The historical 32/1 exit 1 run and its page-confirmed proposal stay on record. Append a note to awkit-djnl.4 giving the commit and these results. Refresh the JSONL export. Nothing closes: awkit-djnl.4 stays in_progress, and L3 section 9 acceptance is not met. No edge is added or removed. The lease writes .beads/** only.",
    "requested_by": "repository owner",
    "risk_level": 1,
    "mode": "change"
  },
  "repository": {
    "branch": "main",
    "baseline_commit": "3ae82002",
    "working_tree_expected": "clean",
    "preserved_paths": []
  },
  "classification": {
    "project_state_change": true,
    "cross_layer_count": 1
  },
  "routing": {
    "manager": "manager",
    "activated_agents": [
      "manager",
      "project-state"
    ],
    "expected_paths": [
      ".beads/**"
    ],
    "consultants": [],
    "writer": {
      "agent_id": "project-state",
      "allowed_paths": [
        ".beads/**"
      ],
      "forbidden_paths": [
        "app/**",
        "src/**",
        "resources/**",
        "scripts/**",
        "tools/**"
      ]
    },
    "reviewers": []
  },
  "acceptance": [
    {
      "id": "tracker-reflects-reality",
      "description": "awkit-djnl.4 stays in_progress with a note naming 3ae82002 and its results, no edge changes, the JSONL export is refreshed from the database, and the dashboard reports that its sources agree.",
      "evidence_required": [
        "roadmap-dashboard"
      ]
    }
  ],
  "evidence": [
    {
      "id": "roadmap-dashboard",
      "type": "verifier",
      "command": "npm run verify:roadmap-dashboard",
      "artifact": null,
      "required": true,
      "result": "PASS",
      "notes": "177/177 with the Overview banner on 'Sources agree' on round 1, run once after the lease release, after `bd update awkit-djnl.4 --append-notes` and `bd export -o .beads/issues.jsonl`: 26 outstanding / 294 closed with 180 edges, the export diff touching only awkit-djnl.4's line, and both narratives restating 65 PASS / 2 NOT RUN / 0 BLOCKED."
    }
  ],
  "git": {
    "commit_policy": "coherent",
    "direct_main": true,
    "force_push": false,
    "destructive_reset": false,
    "push_authorized": true
  },
  "completion": {
    "status": "complete",
    "qa_status": "PASS",
    "qc_status": "NOT_REQUIRED"
  },
  "write_lease": {
    "history": [
      {
        "id": "awkit-djnl-4-spy-live-closeout-note-0923:project-state:2026-09-23T19:54:43.344Z",
        "task": "awkit-djnl-4-spy-live-closeout-note-0923",
        "holder": "project-state",
        "status": "released",
        "allowed_paths": [
          ".beads/**"
        ],
        "acquired_at": "2026-09-23T19:54:43.344Z",
        "acquired_at_commit": "3ae82002421c052a58061783b33ce2898d994807",
        "released_at": "2026-09-23T19:56:01.092Z",
        "released_reason": "Element Spy live verifier closeout noted on awkit-djnl.4 at 3ae82002, nothing closed, no edge changed, export refreshed",
        "amendments": [],
        "overrides": [],
        "violations": []
      }
    ]
  }
}
